{
  "version": "1.0.0",
  "rig_id": "brian_may_treble_booster",
  "name": "Brian May Treble Booster",
  "tags": [
    "queen",
    "brian-may",
    "treble-booster",
    "vox-ac30",
    "harmonics",
    "red-special"
  ],
  "parent": null,
  "created": "2026-02-14T07:43:00Z",
  "notes": "Brian May's treble booster into Vox AC30 setup. Stacked harmonics with bright, cutting tone and wide stereo positioning for orchestral guitar layers.",
  "io": {
    "in": "mono",
    "out": "stereo"
  },
  "scenes": {
    "A": {
      "label": "Clean Bright",
      "params": {
        "dyn": {
          "enable": true,
          "thresh_db": -16.0,
          "ratio": 2.5,
          "knee_db": 5.0,
          "attack_ms": 15.0,
          "release_ms": 180.0,
          "makeup_db": 3.0,
          "mix": 0.5
        },
        "drv": {
          "type": 0,
          "pre_gain_db": 8.0,
          "asym": 0.1,
          "tone_tilt": 0.7,
          "low_cut_hz": 100.0,
          "high_cut_hz": 18000.0,
          "mix": 0.4,
          "level_db": 0.0
        },
        "chr": {
          "mode": 0,
          "rate_hz": 0.5,
          "depth": 0.0,
          "mix": 0.0,
          "tone": 0.0
        },
        "stp": {
          "width": 0.8,
          "micro_delay_ms": 7.0,
          "micro_pitch_cents": 4.0,
          "seed": 0.3
        },
        "spc": {
          "mode": 2,
          "pre_delay_ms": 18.0,
          "decay_s": 2.8,
          "damp": 0.35,
          "diffusion": 0.7,
          "mod": 0.25,
          "wet": 0.35,
          "dry": 1.0
        },
        "cab": {
          "voicing": 3,
          "low_res_hz": 95.0,
          "low_res_q": 0.7,
          "mid_scoop_db": 1.0,
          "high_roll_hz": 10000.0,
          "air": 0.6
        },
        "out": {
          "level_db": -3.5,
          "lim_thresh_db": -7.0,
          "lim_release_ms": 180.0
        }
      }
    },
    "B": {
      "label": "Treble Boost Lead",
      "params": {
        "dyn": {
          "enable": true,
          "thresh_db": -18.0,
          "ratio": 3.2,
          "knee_db": 6.0,
          "attack_ms": 20.0,
          "release_ms": 220.0,
          "makeup_db": 4.5,
          "mix": 0.65
        },
        "drv": {
          "type": 1,
          "pre_gain_db": 18.0,
          "asym": 0.2,
          "tone_tilt": 0.8,
          "low_cut_hz": 120.0,
          "high_cut_hz": 12000.0,
          "mix": 0.7,
          "level_db": 3.0
        },
        "chr": {
          "mode": 0,
          "rate_hz": 0.5,
          "depth": 0.0,
          "mix": 0.0,
          "tone": 0.0
        },
        "stp": {
          "width": 0.9,
          "micro_delay_ms": 8.5,
          "micro_pitch_cents": 5.0,
          "seed": 0.3
        },
        "spc": {
          "mode": 2,
          "pre_delay_ms": 25.0,
          "decay_s": 4.2,
          "damp": 0.3,
          "diffusion": 0.8,
          "mod": 0.3,
          "wet": 0.45,
          "dry": 1.0
        },
        "cab": {
          "voicing": 3,
          "low_res_hz": 105.0,
          "low_res_q": 0.8,
          "mid_scoop_db": 0.5,
          "high_roll_hz": 11000.0,
          "air": 0.7
        },
        "out": {
          "level_db": -1.0,
          "lim_thresh_db": -4.0,
          "lim_release_ms": 200.0
        }
      }
    }
  }
}