{
  "version": "1.0.0",
  "rig_id": "jack_white_garage_fuzz",
  "name": "Jack White Garage Fuzz",
  "tags": [
    "jack-white",
    "white-stripes",
    "garage-rock",
    "octave-fuzz",
    "lo-fi",
    "raw"
  ],
  "parent": null,
  "created": "2026-02-14T07:43:00Z",
  "notes": "Jack White's lo-fi garage attack. Searing octave fuzz with tight cabinet response, no reverb for raw, unprocessed garage rock aggression.",
  "io": {
    "in": "mono",
    "out": "stereo"
  },
  "scenes": {
    "A": {
      "label": "Raw Clean",
      "params": {
        "dyn": {
          "enable": true,
          "thresh_db": -8.0,
          "ratio": 1.5,
          "knee_db": 1.0,
          "attack_ms": 3.0,
          "release_ms": 50.0,
          "makeup_db": 1.0,
          "mix": 0.3
        },
        "drv": {
          "type": 1,
          "pre_gain_db": 6.0,
          "asym": 0.1,
          "tone_tilt": 0.3,
          "low_cut_hz": 120.0,
          "high_cut_hz": 8000.0,
          "mix": 0.4,
          "level_db": 0.0
        },
        "chr": {
          "mode": 0,
          "rate_hz": 0.5,
          "depth": 0.0,
          "mix": 0.0,
          "tone": 0.0
        },
        "stp": {
          "width": 0.2,
          "micro_delay_ms": 1.0,
          "micro_pitch_cents": 0.5,
          "seed": 0.8
        },
        "spc": {
          "mode": 0,
          "pre_delay_ms": 0.0,
          "decay_s": 0.3,
          "damp": 0.9,
          "diffusion": 0.2,
          "mod": 0.0,
          "wet": 0.05,
          "dry": 1.0
        },
        "cab": {
          "voicing": 1,
          "low_res_hz": 140.0,
          "low_res_q": 1.5,
          "mid_scoop_db": 2.0,
          "high_roll_hz": 6000.0,
          "air": 0.1
        },
        "out": {
          "level_db": -2.0,
          "lim_thresh_db": -4.0,
          "lim_release_ms": 40.0
        }
      }
    },
    "B": {
      "label": "Octave Fuzz",
      "params": {
        "dyn": {
          "enable": true,
          "thresh_db": -12.0,
          "ratio": 2.0,
          "knee_db": 2.0,
          "attack_ms": 2.0,
          "release_ms": 40.0,
          "makeup_db": 2.5,
          "mix": 0.4
        },
        "drv": {
          "type": 4,
          "pre_gain_db": 32.0,
          "asym": 0.6,
          "tone_tilt": 0.7,
          "low_cut_hz": 180.0,
          "high_cut_hz": 5000.0,
          "mix": 1.0,
          "level_db": 5.0
        },
        "chr": {
          "mode": 0,
          "rate_hz": 0.5,
          "depth": 0.0,
          "mix": 0.0,
          "tone": 0.0
        },
        "stp": {
          "width": 0.1,
          "micro_delay_ms": 0.5,
          "micro_pitch_cents": 0.3,
          "seed": 0.8
        },
        "spc": {
          "mode": 0,
          "pre_delay_ms": 0.0,
          "decay_s": 0.2,
          "damp": 1.0,
          "diffusion": 0.1,
          "mod": 0.0,
          "wet": 0.0,
          "dry": 1.0
        },
        "cab": {
          "voicing": 1,
          "low_res_hz": 160.0,
          "low_res_q": 1.8,
          "mid_scoop_db": 1.5,
          "high_roll_hz": 5500.0,
          "air": 0.05
        },
        "out": {
          "level_db": 2.0,
          "lim_thresh_db": -1.0,
          "lim_release_ms": 30.0
        }
      }
    }
  }
}